{"format_version":1,"artifact_id":"705163c2d401e60115dce5bd457d8e31d77b275ff155205cbefd58a6cf68f7d9","entries":["node:01a1095c2e437b9e9de51d9d951a1e2c"],"endings":[{"node":"node:01a1095c2e4377c3b19d2d0379951e5b","class":"unspecified","reachable":true,"clusters":["cluster:0d9f12797b321c0284ca972801bd6306","cluster:2b0d4344a2940470bda98c31e0806b23","cluster:684071614467a2a5310d3736320a90e0","cluster:72687ae74ec9ed33fbbdd74906b8a774","cluster:848b982918ded24849bf4842c78a6efb","cluster:8a3c618d930a5bee09b5a895aa89dd75","cluster:b3b73703416b24b40995a9329d4fbdaa","cluster:c385ca38682ec4e9e4054375bed0ae86","cluster:cc8ee7f961b1adc8739abf2971ee6c5b","cluster:edd0f7da6d4493ae218a33c72109e787","cluster:f41f05710d41f3931cc14a4c34aa4f4f","cluster:fc018ddf98a0502fe9b6baba1cf26c1d"]},{"node":"node:01a1095c2e437cc1bdfa2c6bbc6e529b","class":"unspecified","reachable":true,"clusters":["cluster:0d9f12797b321c0284ca972801bd6306","cluster:2b0d4344a2940470bda98c31e0806b23","cluster:684071614467a2a5310d3736320a90e0","cluster:72687ae74ec9ed33fbbdd74906b8a774","cluster:848b982918ded24849bf4842c78a6efb","cluster:8a3c618d930a5bee09b5a895aa89dd75","cluster:b3b73703416b24b40995a9329d4fbdaa","cluster:c385ca38682ec4e9e4054375bed0ae86","cluster:cc8ee7f961b1adc8739abf2971ee6c5b","cluster:edd0f7da6d4493ae218a33c72109e787","cluster:f41f05710d41f3931cc14a4c34aa4f4f","cluster:fc018ddf98a0502fe9b6baba1cf26c1d"]}],"bottleneck_runs":[{"cluster":"cluster:2b0d4344a2940470bda98c31e0806b23","first":"node:01a1095c2e437b9e9de51d9d951a1e2c","last":"node:01a1095c2e437b9e9de51d9d951a1e2c","node_count":1},{"cluster":"cluster:edd0f7da6d4493ae218a33c72109e787","first":"node:01a1095c2e437cb3adf31442154f39a4","last":"node:01a1095c2e437cb3adf31442154f39a4","node_count":1},{"cluster":"cluster:8a3c618d930a5bee09b5a895aa89dd75","first":"node:01a1095c2e43768780152bc61c64951c","last":"node:01a1095c2e43768780152bc61c64951c","node_count":1},{"cluster":"cluster:0d9f12797b321c0284ca972801bd6306","first":"node:01a1095c2e43771ca52d99cc33516245","last":"node:01a1095c2e43771ca52d99cc33516245","node_count":1},{"cluster":"cluster:b3b73703416b24b40995a9329d4fbdaa","first":"node:01a1095c2e437f11bd35937bb860612d","last":"node:01a1095c2e437f11bd35937bb860612d","node_count":1}]}