{"format_version":1,"artifact_id":null,"entries":["node:00000000000000000000000000000000"],"endings":[{"node":"node:00000000000000000000000000000019","class":"failure","reachable":true,"clusters":["cluster:00000000000000000000000000000000","cluster:00000000000000000000000000000001","cluster:00000000000000000000000000000002","cluster:00000000000000000000000000000003","cluster:00000000000000000000000000000004"]},{"node":"node:0000000000000000000000000000001b","class":"success","reachable":true,"clusters":["cluster:00000000000000000000000000000000","cluster:00000000000000000000000000000001","cluster:00000000000000000000000000000002","cluster:00000000000000000000000000000003","cluster:00000000000000000000000000000004"]},{"node":"node:00000000000000000000000000000023","class":"neutral","reachable":false,"clusters":[]}],"bottleneck_runs":[{"cluster":"cluster:00000000000000000000000000000000","first":"node:00000000000000000000000000000000","last":"node:00000000000000000000000000000003","node_count":4},{"cluster":"cluster:00000000000000000000000000000002","first":"node:0000000000000000000000000000000c","last":"node:00000000000000000000000000000011","node_count":6},{"cluster":"cluster:00000000000000000000000000000003","first":"node:00000000000000000000000000000012","last":"node:00000000000000000000000000000017","node_count":6},{"cluster":"cluster:00000000000000000000000000000004","first":"node:00000000000000000000000000000018","last":"node:00000000000000000000000000000018","node_count":1}]}